{
  "$schema": "https://json-schema.org/draft/2020-12/schema",
  "$id": "https://kratos.dev/schemas/state/snapshot/v1",
  "title": "Kratos state snapshot v1",
  "type": "object",
  "additionalProperties": false,
  "required": [
    "contractVersion",
    "stateContract",
    "projectId",
    "runId",
    "status",
    "currentStep",
    "eventCursor",
    "eventHash",
    "policyVersion",
    "lineage",
    "createdAt",
    "updatedAt"
  ],
  "properties": {
    "contractVersion": { "const": "1.0.0" },
    "stateContract": { "const": "1.0.0" },
    "projectId": { "$ref": "#/$defs/id" },
    "runId": { "$ref": "#/$defs/id" },
    "status": { "enum": ["idle", "active", "blocked", "completed"] },
    "currentStep": { "oneOf": [{ "$ref": "#/$defs/id" }, { "type": "null" }] },
    "eventCursor": {
      "type": "integer",
      "minimum": 0,
      "maximum": 9007199254740991
    },
    "eventHash": { "$ref": "#/$defs/sha256" },
    "policyVersion": { "$ref": "#/$defs/id" },
    "lineage": {
      "type": "object",
      "additionalProperties": false,
      "required": ["prdDigest", "specDigest"],
      "properties": {
        "prdDigest": { "$ref": "#/$defs/sha256" },
        "specDigest": { "$ref": "#/$defs/sha256" }
      }
    },
    "createdAt": { "$ref": "#/$defs/timestamp" },
    "updatedAt": { "$ref": "#/$defs/timestamp" }
  },
  "$defs": {
    "id": {
      "type": "string",
      "pattern": "^[a-zA-Z0-9][a-zA-Z0-9._:-]{0,127}$"
    },
    "sha256": { "type": "string", "pattern": "^[a-f0-9]{64}$" },
    "timestamp": {
      "type": "string",
      "pattern": "^\\d{4}-(?:0[1-9]|1[0-2])-(?:0[1-9]|[12]\\d|3[01])T(?:[01]\\d|2[0-3]):[0-5]\\d:[0-5]\\d(?:\\.\\d{1,9})?Z$"
    }
  }
}
