{
  "contractVersion": "1.0.0",
  "stateContract": "1.0.0",
  "projectId": "project-01",
  "runId": "run-01",
  "status": "active",
  "currentStep": "specification",
  "eventCursor": 1,
  "eventHash": "aaaaaaaaaaaaaaaaaaaaaaaaaaaaaaaaaaaaaaaaaaaaaaaaaaaaaaaaaaaaaaaa",
  "policyVersion": "policy-01",
  "lineage": {
    "prdDigest": "bbbbbbbbbbbbbbbbbbbbbbbbbbbbbbbbbbbbbbbbbbbbbbbbbbbbbbbbbbbbbbbb",
    "specDigest": "cccccccccccccccccccccccccccccccccccccccccccccccccccccccccccccccc"
  },
  "createdAt": "2026-08-07T00:00:00Z",
  "updatedAt": "2026-08-07T00:01:00Z"
}
